{
  "schema_version": "1.0.0",
  "as_of": "2026-09-12",
  "mapping_count": 68,
  "mappings": [
    {
      "id": "MAP-LEVEL-01",
      "kind": "gym_level",
      "label": "Level 1 basic opacity new-tab trap",
      "primary_scenario_id": "NS-ADV-UI-001",
      "supporting_scenario_ids": [
        "NS-ADV-WIN-001"
      ],
      "primary_harm_boundary": "Trusted input opens an unauthorized browsing context through a transparent full-viewport target.",
      "role": "primitive",
      "current_oracle": "Playwright checks that the unexpected page does not survive and that a NavSentinel intervention appears.",
      "oracle_type": "mixed",
      "evidence_state": "MODELLED",
      "evidence_validity": "CURRENT_REGRESSION",
      "known_limitation": "The fixture has no independent sink receipt and the product event remains part of the pass condition.",
      "issue_refs": [],
      "pr_refs": [],
      "paths": [
        "gym/level1-basic-opacity.html",
        "tests/e2e/navsentinel.spec.ts"
      ]
    },
    {
      "id": "MAP-LEVEL-02",
      "kind": "gym_level",
      "label": "Level 2 moving target",
      "primary_scenario_id": "NS-ADV-UI-002",
      "supporting_scenario_ids": [],
      "primary_harm_boundary": "The activation target materially changes between inspection and the trusted click.",
      "role": "primitive",
      "current_oracle": "Playwright observes the blocked unexpected browsing context and product UI.",
      "oracle_type": "mixed",
      "evidence_state": "MODELLED",
      "evidence_validity": "CURRENT_REGRESSION",
      "known_limitation": "No independent record proves the actual inspected target, final hit target, and consequence as separate facts.",
      "issue_refs": [],
      "pr_refs": [],
      "paths": [
        "gym/level2-moving-target.html",
        "tests/e2e/navsentinel.spec.ts"
      ]
    },
    {
      "id": "MAP-LEVEL-03",
      "kind": "gym_level",
      "label": "Level 3 instant injection",
      "primary_scenario_id": "NS-ADV-UI-003",
      "supporting_scenario_ids": [
        "NS-ADV-RUNTIME-007"
      ],
      "primary_harm_boundary": "A newly injected target changes the consequence around the user's activation.",
      "role": "primitive",
      "current_oracle": "Playwright checks the unauthorized page is blocked and the intervention is rendered.",
      "oracle_type": "mixed",
      "evidence_state": "MODELLED",
      "evidence_validity": "CURRENT_REGRESSION",
      "known_limitation": "The test is one authored timing point and does not establish adjacent timing robustness.",
      "issue_refs": [],
      "pr_refs": [],
      "paths": [
        "gym/level3-instant-injection.html",
        "tests/e2e/navsentinel.spec.ts"
      ]
    },
    {
      "id": "MAP-LEVEL-04",
      "kind": "gym_level",
      "label": "Level 4 visual mimicry",
      "primary_scenario_id": "NS-ADV-UI-006",
      "supporting_scenario_ids": [
        "NS-ADV-IDN-004"
      ],
      "primary_harm_boundary": "A browser-like page surface induces an action whose effective destination differs from the displayed context.",
      "role": "primitive",
      "current_oracle": "Playwright checks the deceptive navigation outcome and product UI state.",
      "oracle_type": "mixed",
      "evidence_state": "MODELLED",
      "evidence_validity": "CURRENT_REGRESSION",
      "known_limitation": "The fixture models one visual surface and is not evidence of general browser-in-the-browser recognition.",
      "issue_refs": [],
      "pr_refs": [],
      "paths": [
        "gym/level4-visual-mimicry.html",
        "tests/e2e/navsentinel.spec.ts"
      ]
    },
    {
      "id": "MAP-LEVEL-05",
      "kind": "gym_level",
      "label": "Level 5 popunder",
      "primary_scenario_id": "NS-ADV-WIN-001",
      "supporting_scenario_ids": [],
      "primary_harm_boundary": "One trusted action creates an extra unauthorized browsing context.",
      "role": "primitive",
      "current_oracle": "Playwright counts browsing contexts and checks the unexpected popup is absent.",
      "oracle_type": "browser_outcome",
      "evidence_state": "MODELLED",
      "evidence_validity": "CURRENT_REGRESSION",
      "known_limitation": "The authored primitive does not cover window geometry, named reuse, or long-delay variants.",
      "issue_refs": [],
      "pr_refs": [],
      "paths": [
        "gym/level5-window-open-popunder.html",
        "tests/e2e/navsentinel.spec.ts"
      ]
    },
    {
      "id": "MAP-LEVEL-06",
      "kind": "gym_level",
      "label": "Level 6 programmatic click",
      "primary_scenario_id": "NS-ADV-SELF-003",
      "supporting_scenario_ids": [
        "NS-ADV-UI-003"
      ],
      "primary_harm_boundary": "A page-generated activation attempts to consume authority for a user-level consequence.",
      "role": "primitive",
      "current_oracle": "Playwright checks that the programmatic action does not produce the protected navigation.",
      "oracle_type": "browser_outcome",
      "evidence_state": "MODELLED",
      "evidence_validity": "CURRENT_REGRESSION",
      "known_limitation": "Synthetic input is not inherently malicious; this primitive does not model accessibility or delegated-agent authority.",
      "issue_refs": [],
      "pr_refs": [
        "#464"
      ],
      "paths": [
        "gym/level6-programmatic-click.html",
        "tests/e2e/navsentinel.spec.ts"
      ]
    },
    {
      "id": "MAP-LEVEL-07",
      "kind": "gym_level",
      "label": "Level 7 legitimate modal backdrop",
      "primary_scenario_id": "NS-ADV-UI-001",
      "supporting_scenario_ids": [
        "NS-ADV-PERM-008"
      ],
      "primary_harm_boundary": "No unauthorized consequence occurs; the accessible modal must remain usable.",
      "role": "benign",
      "current_oracle": "Playwright completes the intended modal interaction without a NavSentinel block.",
      "oracle_type": "browser_outcome",
      "evidence_state": "MODELLED",
      "evidence_validity": "CURRENT_REGRESSION",
      "known_limitation": "One fixture does not cover the full accessibility, framework, and stacking-context control space.",
      "issue_refs": [],
      "pr_refs": [],
      "paths": [
        "gym/level7-legit-modal-backdrop.html",
        "tests/e2e/navsentinel.spec.ts"
      ]
    },
    {
      "id": "MAP-LEVEL-08",
      "kind": "gym_level",
      "label": "Level 8 legitimate OAuth popup",
      "primary_scenario_id": "NS-ADV-AUTH-005",
      "supporting_scenario_ids": [
        "NS-ADV-WIN-002"
      ],
      "primary_harm_boundary": "A scoped authentication popup must complete without authorizing an unrelated second context.",
      "role": "benign",
      "current_oracle": "Playwright uses trusted input and verifies one legitimate popup completes without an unexpected prompt.",
      "oracle_type": "browser_outcome",
      "evidence_state": "MODELLED",
      "evidence_validity": "CURRENT_REGRESSION",
      "known_limitation": "The synthetic local flow does not validate provider protocol, redirect state, or open-web OAuth compatibility.",
      "issue_refs": [
        "#223"
      ],
      "pr_refs": [],
      "paths": [
        "gym/level8-legit-oauth-popup.html",
        "gym/level8-oauth-consent.html",
        "tests/e2e/navsentinel.spec.ts"
      ]
    },
    {
      "id": "MAP-LEVEL-09",
      "kind": "gym_level",
      "label": "Level 9 legitimate video overlay",
      "primary_scenario_id": "NS-ADV-UI-004",
      "supporting_scenario_ids": [
        "NS-ADV-SUPPLY-006"
      ],
      "primary_harm_boundary": "A legitimate foreground media control remains usable and does not create an unauthorized consequence.",
      "role": "benign",
      "current_oracle": "Playwright completes the intended video-overlay interaction without suppression or blocking.",
      "oracle_type": "browser_outcome",
      "evidence_state": "MODELLED",
      "evidence_validity": "CURRENT_REGRESSION",
      "known_limitation": "This control does not cover embedded real-player variance or every accessible dialog pattern.",
      "issue_refs": [
        "#594"
      ],
      "pr_refs": [],
      "paths": [
        "gym/level9-legit-video-overlay.html",
        "tests/e2e/navsentinel.spec.ts"
      ]
    },
    {
      "id": "MAP-LEVEL-10",
      "kind": "gym_level",
      "label": "Level 10 redirects and forms",
      "primary_scenario_id": "NS-ADV-NAV-001",
      "supporting_scenario_ids": [
        "NS-ADV-CRED-003"
      ],
      "primary_harm_boundary": "A delayed navigation commits or a changed form destination receives protected input outside scoped intent.",
      "role": "mixed",
      "current_oracle": "Playwright checks redirect recovery and form-prompt behavior through browser and product UI state.",
      "oracle_type": "mixed",
      "evidence_state": "MODELLED",
      "evidence_validity": "CURRENT_REGRESSION",
      "known_limitation": "Rollback is post-commit containment and the form path lacks a typed independent protected-data sink receipt.",
      "issue_refs": [
        "#458"
      ],
      "pr_refs": [],
      "paths": [
        "gym/level10-redirects-and-forms.html",
        "tests/e2e/navsentinel.spec.ts"
      ]
    },
    {
      "id": "MAP-LEVEL-11",
      "kind": "gym_level",
      "label": "Level 11 credential guard",
      "primary_scenario_id": "NS-ADV-CRED-001",
      "supporting_scenario_ids": [
        "NS-ADV-CRED-003"
      ],
      "primary_harm_boundary": "A synthetic password submit reaches an unexpected or insecure destination.",
      "role": "mixed",
      "current_oracle": "Playwright checks that risky submits prompt and legitimate/trusted submits complete.",
      "oracle_type": "mixed",
      "evidence_state": "MODELLED",
      "evidence_validity": "CURRENT_REGRESSION",
      "known_limitation": "Product modal state is the principal oracle; the lane does not prove all script-based exfiltration sinks.",
      "issue_refs": [
        "#199",
        "#200"
      ],
      "pr_refs": [],